{
  "journey_id": "JRN-023",
  "name": "Correspondent Bank Relationship Setup",
  "status": "Draft",
  "triggering_persona": "PER-008",
  "capabilities_touched": ["CAP-002", "CAP-003", "CAP-005"],
  "phases": [
    {
      "id": "PH-127",
      "name": "FATF EDD and KYC Assessment",
      "description": "The Treasury team (PER-053) identifies the need for a new correspondent banking relationship. The Compliance team (SVC-015) conducts FATF Recommendation 13 Enhanced Due Diligence: SWIFT KYC Registry lookup, regulatory status verification, AML controls review, sanctions screening programme assessment. SVC-014 runs sanctions screening on the correspondent bank entity. A CorrespondentRelationship record is created in status = under_assessment. Senior Management approval is required per MLR 2017 Regulation 34.",
      "actors": ["PER-053", "PER-052", "SVC-015", "SVC-014"],
      "services": ["SVC-015", "SVC-014"],
      "governance_rules": ["GOV-005-R04"],
      "entry_conditions": [
        "Business case approved for new currency corridor",
        "Correspondent bank identified and SWIFT KYC Registry entry verified"
      ],
      "exit_conditions": [
        "CorrespondentRelationship created with status = under_assessment",
        "EDD documentation compiled",
        "Sanctions screening completed — no hits",
        "EVT-163 CorrespondentEddCompleted published"
      ]
    },
    {
      "id": "PH-128",
      "name": "Senior Management Approval",
      "description": "The Head of Compliance (SMF16) and MLRO (SMF17) review the EDD documentation and risk assessment. Senior Management approval obtained per MLR 2017 Regulation 34 requirement. CorrespondentRelationship updated to status = approved.",
      "actors": ["PER-059", "SVC-015"],
      "services": ["SVC-015"],
      "governance_rules": ["GOV-005-R04"],
      "entry_conditions": [
        "CorrespondentRelationship in status = under_assessment",
        "EDD documentation complete with no unresolved red flags"
      ],
      "exit_conditions": [
        "CorrespondentRelationship updated to status = approved",
        "SMF approval attestation recorded",
        "Correspondent banking agreement executed"
      ]
    },
    {
      "id": "PH-129",
      "name": "Nostro Account Setup and SWIFT Registration",
      "description": "The Treasury team (SVC-007) creates the nostro account for the new correspondent relationship. SWIFT BIC for the correspondent is registered in the payment routing table (SVC-010). A test SWIFT MT202 message is exchanged to confirm the channel is live.",
      "actors": ["PER-053", "SVC-007", "SVC-010"],
      "services": ["SVC-007", "SVC-010"],
      "governance_rules": ["GOV-003-R01"],
      "entry_conditions": [
        "CorrespondentRelationship in status = approved",
        "Correspondent banking agreement executed"
      ],
      "exit_conditions": [
        "Nostro account created in SVC-007",
        "Correspondent BIC registered in payment routing table (SVC-010)",
        "Test SWIFT message successfully exchanged",
        "EVT-164 CorrespondentOnboarded published"
      ]
    },
    {
      "id": "PH-130",
      "name": "Annual EDD Review Scheduling",
      "description": "The Compliance system (SVC-015) schedules the annual EDD review for the new correspondent relationship per MLR 2017 Regulation 34 ongoing monitoring requirement. CorrespondentRelationship updated to status = active. Annual review due date set to 12 months from onboarding date.",
      "actors": ["SVC-015"],
      "services": ["SVC-015"],
      "governance_rules": ["GOV-005-R04"],
      "entry_conditions": [
        "EVT-164 CorrespondentOnboarded received",
        "Nostro account and SWIFT channel confirmed live"
      ],
      "exit_conditions": [
        "CorrespondentRelationship status = active",
        "Annual EDD review scheduled for next year"
      ]
    }
  ],
  "paths": {
    "happy_path": {
      "description": "Treasury identifies new corridor → Compliance conducts FATF R13 EDD → Senior Management approves → nostro account set up and SWIFT registered → test message exchanged → relationship live.",
      "phases": ["PH-127", "PH-128", "PH-129", "PH-130"]
    },
    "alternative_paths": [
      {
        "id": "ALT-023-01",
        "name": "EDD Red Flag — Enhanced Review",
        "description": "EDD identifies a red flag (e.g. correspondent bank in a FATF grey-listed jurisdiction). Enhanced review required. Senior Management risk decision documented. Relationship may proceed with enhanced monitoring controls or be rejected.",
        "phases": ["PH-127", "PH-128"],
        "diverges_at": "PH-127: EDD identifies a FATF grey-list or elevated-risk indicator"
      }
    ],
    "exception_paths": [
      {
        "id": "EXC-023-01",
        "name": "Sanctions Hit — Relationship Rejected",
        "description": "Sanctions screening (SVC-014) identifies a positive hit against the correspondent bank entity or its beneficial owners. CorrespondentRelationship set to status = rejected. EVT-163 not published. OFSI/FCA notified if required. Relationship cannot proceed.",
        "phases": ["PH-127"],
        "diverges_at": "PH-127: SVC-014 sanctions screening returns a positive hit"
      }
    ]
  },
  "design_decisions": [
    {
      "id": "DD-023-01",
      "decision": "CorrespondentRelationship entity is owned by SVC-015 (Compliance Core, CAP-005) as the regulatory accountability system. The nostro account is owned by SVC-007 (Treasury Services, CAP-002). The payment routing BIC registration is owned by SVC-010 (International Payments, CAP-003).",
      "rationale": "Three distinct domain concerns: regulatory EDD (CAP-005), treasury account management (CAP-002), payment routing (CAP-003). Each capability owns its respective data.",
      "alternatives_considered": "Single entity spanning all three — rejected as it would create cross-capability data ownership."
    }
  ]
}
